<?xml version="1.0" encoding="UTF-8"?>
<manifest identifier="SBH-CACP-MODULE2"
          version="1.0"
          xmlns="http://www.imsproject.org/xsd/imscp_rootv1p1p2"
          xmlns:adlcp="http://www.adlnet.org/xsd/adlcp_rootv1p2"
          xmlns:xsi="http://www.w3.org/2001/XMLSchema-instance"
          xsi:schemaLocation="http://www.imsproject.org/xsd/imscp_rootv1p1p2
                              imscp_rootv1p1p2.xsd
                              http://www.adlnet.org/xsd/adlcp_rootv1p2
                              adlcp_rootv1p2.xsd">

  <metadata>
    <schema>ADL SCORM</schema>
    <schemaversion>1.2</schemaversion>
  </metadata>

  <organizations default="SBH-CACP-ORG">
    <organization identifier="SBH-CACP-ORG">
      <title>Communication &amp; Advance Care Planning — Palliative Care Fundamentals Module 2</title>
      <item identifier="item-1" identifierref="resource-1">
        <title>Communication &amp; Advance Care Planning</title>
        <adlcp:masteryscore>80</adlcp:masteryscore>
      </item>
    </organization>
  </organizations>

  <resources>
    <resource identifier="resource-1"
              type="webcontent"
              adlcp:scormtype="sco"
              href="index.html">

      <!-- Entry point -->
      <file href="index.html"/>

      <!-- JavaScript -->
      <file href="js/scorm.js"/>
      <file href="js/navigation.js"/>
      <file href="js/communication.js"/>
      <file href="js/flashcards.js"/>
      <file href="js/capacity.js"/>
      <file href="js/toolmatch.js"/>
      <file href="js/scenario.js"/>
      <file href="js/quiz.js"/>
      <file href="js/record.js"/>
      <file href="js/page-loader.js"/>
      <file href="js/main.js"/>

      <!-- CSS -->
      <file href="css/base.css"/>
      <file href="css/layout.css"/>
      <file href="css/buttons.css"/>
      <file href="css/modals.css"/>
      <file href="css/components/intro.css"/>
      <file href="css/components/content.css"/>
      <file href="css/components/activities.css"/>
      <file href="css/components/pages.css"/>

      <!-- Pages -->
      <file href="pages/page-01-intro.html"/>
      <file href="pages/page-02-communication.html"/>
      <file href="pages/page-03-comm-practice.html"/>
      <file href="pages/page-04-mca-principles.html"/>
      <file href="pages/page-05-capacity-test.html"/>
      <file href="pages/page-06-legal-protections.html"/>
      <file href="pages/page-07-acp-tools.html"/>
      <file href="pages/page-08-best-interests.html"/>
      <file href="pages/page-09-scenario.html"/>
      <file href="pages/page-10-quiz.html"/>
      <file href="pages/page-11-record.html"/>

      <!-- Images -->
      <file href="images/logo.jpg"/>

    </resource>
  </resources>

</manifest>
