<?xml version="1.0" encoding="UTF-8"?>
<manifest identifier="SBH_PALLIATIVE_CARE_EOL_MODULE_1"
          version="1.0"
          xmlns="http://www.imsproject.org/xsd/imscp_rootv1p1p2"
          xmlns:adlcp="http://www.adlnet.org/xsd/adlcp_rootv1p2"
          xmlns:xsi="http://www.w3.org/2001/XMLSchema-instance"
          xsi:schemaLocation="http://www.imsproject.org/xsd/imscp_rootv1p1p2 imscp_rootv1p1p2.xsd
                              http://www.adlnet.org/xsd/adlcp_rootv1p2      adlcp_rootv1p2.xsd">

  <metadata>
    <schema>ADL SCORM</schema>
    <schemaversion>1.2</schemaversion>
  </metadata>

  <organizations default="ORG_SBH_PALLIATIVE">
    <organization identifier="ORG_SBH_PALLIATIVE">
      <title>What is End of Life Palliative Care?</title>
      <item identifier="ITEM_PALLIATIVE_MAIN" identifierref="RES_PALLIATIVE_MAIN">
        <title>What is End of Life Palliative Care? — Full Module</title>
        <adlcp:masteryscore>80</adlcp:masteryscore>
      </item>
    </organization>
  </organizations>

  <resources>
    <resource identifier="RES_PALLIATIVE_MAIN"
              type="webcontent"
              adlcp:scormtype="sco"
              href="index.html">
      <file href="index.html"/>
      <file href="css/styles.css"/>
      <file href="js/scripts.js"/>
    </resource>
  </resources>

</manifest>
